{
  "$schema": "../../schemas/tourism-data.schema.json",
  "site": {
    "name": "Turismo Jujuy",
    "region": "Provincia de Jujuy, Argentina",
    "description": "Descubri la Quebrada, la Puna y los Valles: colores, cultura y altura.",
    "defaultLocale": "es",
    "locales": ["es", "en"],
    "center": { "lat": -23.2, "lng": -65.35, "zoom": 8 }
  },
  "categories": [
    { "id": "naturaleza", "label": "Naturaleza", "icon": "mountain" },
    { "id": "cultura", "label": "Cultura", "icon": "landmark" },
    { "id": "gastronomia", "label": "Gastronomia", "icon": "utensils" }
  ],
  "places": [
    {
      "id": "purmamarca-cerro-7-colores",
      "name": "Cerro de los Siete Colores",
      "category": "naturaleza",
      "coords": { "lat": -23.745, "lng": -65.5 },
      "address": "Purmamarca, Jujuy",
      "shortDescription": "Formacion geologica iconica de la Quebrada de Humahuaca.",
      "description": "",
      "images": ["assets/purmamarca-01.jpg"],
      "hours": "Todo el dia",
      "tags": ["quebrada", "fotografia", "senderismo"],
      "source": "user"
    },
    {
      "id": "salinas-grandes",
      "name": "Salinas Grandes",
      "category": "naturaleza",
      "coords": { "lat": -23.62, "lng": -65.95 },
      "address": "Ruta 52, Jujuy",
      "shortDescription": "Inmenso salar blanco a mas de 3400 msnm.",
      "description": "",
      "images": ["assets/salinas-01.jpg"],
      "hours": "09:00 - 18:00",
      "tags": ["puna", "fotografia", "paisaje"],
      "source": "user"
    },
    {
      "id": "humahuaca-centro",
      "name": "Ciudad de Humahuaca",
      "category": "cultura",
      "coords": { "lat": -23.205, "lng": -65.351 },
      "address": "Humahuaca, Jujuy",
      "shortDescription": "Pueblo historico y corazon cultural de la Quebrada.",
      "description": "",
      "images": ["assets/humahuaca-01.jpg"],
      "hours": "Todo el dia",
      "tags": ["historia", "cultura", "artesania"],
      "source": "user"
    }
  ],
  "events": [
    {
      "id": "carnaval-quebrada-2027",
      "name": "Carnaval de la Quebrada",
      "startDate": "2027-02-06",
      "endDate": "2027-02-17",
      "placeId": "humahuaca-centro",
      "description": "",
      "images": [],
      "recurring": "yearly"
    },
    {
      "id": "fiesta-pachamama",
      "name": "Fiesta de la Pachamama",
      "startDate": "2026-08-01",
      "endDate": "2026-08-31",
      "placeId": "humahuaca-centro",
      "description": "",
      "images": [],
      "recurring": "yearly"
    }
  ]
}
